species_grp,order,family,species_code,common_name,scientific_name,count_2021,count_2020,count_5yr,cons_status,cons_score,cons_desc,diff,abs_diff,perc_diff,peak_month,description,image_url,website
birds,Passeriformes,"Corvidae (Crows, Jays, and Magpies)",stejay,Steller's jay,Cyanocitta stelleri,0,0,0,LC,5,Words words words,Positive,-500,-0.5,March,"Steller's jay is about 30–34 cm (12–13 in) long and weighs about 100–140 g (3.5–4.9 oz). Steller's jay shows a great deal of regional variation throughout its range. Blackish-brown-headed birds from the north gradually become bluer-headed farther south.[3] The Steller's jay has a more slender bill and longer legs than the blue jay and, in northern populations, has a much more pronounced crest.[4]: 69 [5] It is also somewhat larger.",https://upload.wikimedia.org/wikipedia/commons/thumb/c/cf/Steller%27s_Jay_flagstaff_arizona.jpg/220px-Steller%27s_Jay_flagstaff_arizona.jpg,https://en.wikipedia.org/wiki/Steller%27s_jay
birds,Passeriformes,"Icteridae: Blackbirds, Meadowlarks & Orioles",y00022,Bullock's oriole,Icterus bullockii,0,0,0,LC,5,Words words words,Positive,-500,-0.5,March,"Bullock's oriole (Icterus bullockii) is a small New World blackbird. At one time, this species and the Baltimore oriole were considered to be a single species, the northern oriole. This bird is named after William Bullock, an English amateur naturalist.",https://upload.wikimedia.org/wikipedia/commons/thumb/c/ca/Icterus_bullockii.jpg/220px-Icterus_bullockii.jpg,https://en.wikipedia.org/wiki/Bullock%27s_oriole
birds,Passeriformes,"Icteridae: Blackbirds, Meadowlarks & Orioles",wesmea,Western meadowlark,Sturnella neglecta,0,0,0,LC,5,Words words words,Positive,-500,-0.5,March,"The western meadowlark was formally described in 1844 by the American ornithologist John James Audubon under its current binomial name Sturnella neglecta.[2] The specific epithet is from the Latin neglectus meaning ""ignored"", ""overlooked"", ""neglected"" or ""disregarded"".[3] Audubon explained that although the account of the Lewis and Clark Expedition of 1803–1806 mentioned yellow larks, these had never been formally described.[2][4] The type locality is Old Fort Union, North Dakota.[5]",https://upload.wikimedia.org/wikipedia/commons/thumb/4/46/Western_Meadowlark.jpg/220px-Western_Meadowlark.jpg,https://en.wikipedia.org/wiki/Western_meadowlark
birds,Passeriformes,Icteridae (Troupials and Allies),grtgra,Great-tailed grackle,Quiscalus mexicanus,0,0,0,LC,5,Words words words,Positive,-500,-0.5,March,"Great-tailed grackles are medium-sized birds (larger than starlings and smaller than crows; 38 cm (15 in)-46 cm (18 in)) with males weighing 203 g (7.2 oz)-265 g (9.3 oz) and females between 115 g (4.1 oz)-142 g (5.0 oz), and both sexes have long tails.[4] Wingspan ranges from 18.9-22.8 in (48-58 cm).[5] Males are iridescent black with a purple-blue sheen on the feathers of the head and upper body, while females are brown with darker wings and tail.[4] Adults of both sexes have bright yellow eyes, while juveniles of both sexes have brown eyes and brown plumage like females (except for streaks on the breast).[4] Great-tailed grackles, particularly the adult males, have a keel-shaped tail that they can fold vertically by aligning the two halves.[6]",https://upload.wikimedia.org/wikipedia/commons/thumb/8/8e/Quiscalus_mexicanusMPCCA20061226-0567B.jpg/220px-Quiscalus_mexicanusMPCCA20061226-0567B.jpg,https://en.wikipedia.org/wiki/Great-tailed_grackle
birds,Passeriformes,Passerellidae (New World Buntings and Sparrows),abetow,Abert's towhee,Melozone aberti,0,0,0,LC,5,Words words words,Positive,-500,-0.5,March,"Abert's towhee (Melozone aberti) is a bird of the family Passerellidae, native to a small range in southwestern North America, generally the lower Colorado River and Gila River watersheds, nearly endemic to Arizona, but also present in small parts of California, Nevada, Utah, New Mexico, and Sonora in Mexico. The name of this bird commemorates the American ornithologist James William Abert (1820–1897).",https://upload.wikimedia.org/wikipedia/commons/thumb/2/22/Pipilo_aberti.jpg/220px-Pipilo_aberti.jpg,https://en.wikipedia.org/wiki/Abert%27s_towhee
birds,Passeriformes,Bombycillidae: Waxwings,bohwax,Bohemian waxwing,Bombycilla garrulus,0,0,0,LC,5,Words words words,Positive,-500,-0.5,March,"The Bohemian waxwing (Bombycilla garrulus) is a starling-sized passerine bird that breeds in the northern forests of the Palearctic and North America. It has mainly buff-grey plumage, black face markings and a pointed crest. Its wings are patterned with white and bright yellow, and some feather tips have the red waxy appearance that give this species its English name. The three subspecies show only minor differences in appearance. Females are similar to males, although young birds are less well-marked and have few or no waxy wingtips. Although the Bohemian waxwing's range overlaps those of the cedar and Japanese waxwings, it is easily distinguished from them by size and plumage differences.",https://upload.wikimedia.org/wikipedia/commons/thumb/3/3c/Bombycilla_garrulusII.jpg/220px-Bombycilla_garrulusII.jpg,https://en.wikipedia.org/wiki/Bohemian_waxwing
birds,Passeriformes,Passerellidae (New World Buntings and Sparrows),gocspa,Golden-crowned sparrow,Zonotrichia atricapilla,0,0,0,LC,5,Words words words,Positive,-500,-0.5,March,The golden-crowned sparrow (Zonotrichia atricapilla) is a large New World sparrow found in the western part of North America.,https://upload.wikimedia.org/wikipedia/commons/thumb/5/5e/Zonotrichia_atricapilla_-British_Columbia%2C_Canada-8.jpg/220px-Zonotrichia_atricapilla_-British_Columbia%2C_Canada-8.jpg,https://en.wikipedia.org/wiki/Golden-crowned_sparrow
birds,Passeriformes,Aegithalidae (Long-tailed Tits),bushti,American bushtit,Psaltriparus minimus,0,0,0,LC,5,Words words words,Positive,-500,-0.5,March,The American bushtit was formally described by the American naturalist John Kirk Townsend in 1837 and given the binomial name Parus minimus. Townsend noted that the species inhabited the forests of the Columbia River.[2][3] It is now the only species placed in the genus Psaltriparus that was introduced in 1850 by the French naturalist Charles Lucien Bonaparte.[4][5] The genus name Psaltriparus combines the genus Psaltria that was introduced by Coenraad Temminck in 1836 for the pygmy bushtit with Parus that was introduced by Carl Linnaeus in 1758 for the tits.[6],https://upload.wikimedia.org/wikipedia/commons/thumb/3/36/Psaltriparus_minimus_-Chilliwack%2C_British_Columbia%2C_Canada_-male-8.jpg/220px-Psaltriparus_minimus_-Chilliwack%2C_British_Columbia%2C_Canada_-male-8.jpg,https://en.wikipedia.org/wiki/American_bushtit
birds,Passeriformes,Turdidae: Thrushes,amerob,American robin,Turdus migratorius,0,0,0,LC,5,Words words words,Positive,-500,-0.5,March,"The American robin (Turdus migratorius) is a migratory bird of the true thrush genus and Turdidae, the wider thrush family. It is named after the European robin[2] because of its reddish-orange breast, though the two species are not closely related, with the European robin belonging to the Old World flycatcher family. The American robin is widely distributed throughout North America, wintering from southern Canada to central Mexico and along the Pacific Coast. It is the state bird of Connecticut, Michigan, and Wisconsin.[3]",https://upload.wikimedia.org/wikipedia/commons/thumb/b/b8/Turdus-migratorius-002.jpg/220px-Turdus-migratorius-002.jpg,https://en.wikipedia.org/wiki/American_robin
birds,Passeriformes,"Fringillidae: Siskins, Crossbills & Allies",amegfi,American goldfinch,Spinus tristis,0,0,0,LC,5,Words words words,Positive,-500,-0.5,March,"The American goldfinch (Spinus tristis) is a small North American bird in the finch family. It is migratory, ranging from mid-Alberta to North Carolina during the breeding season, and from just south of the Canada–United States border to Mexico during the winter.",https://upload.wikimedia.org/wikipedia/commons/thumb/a/a0/Male_American_Goldfinch_in_Lodi_CA.JPG/220px-Male_American_Goldfinch_in_Lodi_CA.JPG,https://en.wikipedia.org/wiki/American_goldfinch
birds,Passeriformes,"Fringillidae: Siskins, Crossbills & Allies",houfin,House finch,Haemorhous mexicanus,0,0,0,LC,5,Words words words,Positive,-500,-0.5,March,"The house finch (Haemorhous mexicanus) is a bird in the finch family Fringillidae. It is native to western North America and has been introduced to the eastern half of the continent and Hawaii. This species and the other ""American rosefinches"" are placed in the genus Haemorhous.",https://upload.wikimedia.org/wikipedia/commons/thumb/9/99/House_Finch%2C_Stratham%2C_NH.jpg/220px-House_Finch%2C_Stratham%2C_NH.jpg,https://en.wikipedia.org/wiki/House_finch
birds,Passeriformes,Passerellidae: New World Sparrows and Towhees,whtspa,White-throated sparrow,Zonotrichia albicollis,0,0,0,LC,5,Words words words,Positive,-500,-0.5,March,The white-throated sparrow (Zonotrichia albicollis) is a passerine bird of the New World sparrow family Passerellidae.,https://upload.wikimedia.org/wikipedia/commons/thumb/f/f3/Zonotrichia_albicollis_CT1.jpg/220px-Zonotrichia_albicollis_CT1.jpg,https://en.wikipedia.org/wiki/White-throated_sparrow
birds,Passeriformes,Parulidae: Wood Warblers,yerwar,Yellow-rumped warbler,Setophaga coronata,0,0,0,LC,5,Words words words,Positive,-500,-0.5,March,"The yellow-rumped warbler (Setophaga coronata) is a regular North American bird species that can be commonly observed all across the continent. Its extensive distribution range connects both the Pacific and Atlantic coasts of the U.S. as well as Canada and Central America, with the population concentrating in the continent's northern parts during the breeding season and migrating southwards to southern North and Central America in Winter. The species generally prefers coniferous forests or mixed coniferous-deciduous forests as its breeding habitat, while during the winter it can be found inhabiting more open areas such as shrublands that offer food resources. The diet of the yellow-rumped warbler is based primarily on insects, though the species does eat fruits such as juniper berries as well, especially in winter.",https://upload.wikimedia.org/wikipedia/commons/thumb/6/62/Audubon%27s_Warbler_Setophaga_auduboni.jpg/220px-Audubon%27s_Warbler_Setophaga_auduboni.jpg,https://en.wikipedia.org/wiki/Yellow-rumped_warbler
birds,Accipitriformes,"Accipitridae: Kites, Hawks & Eagles",reshaw,Red-shouldered hawk,Buteo lineatus,0,0,0,LC,5,Words words words,Positive,-500,-0.5,March,"The red-shouldered hawk (Buteo lineatus) is a medium-sized buteo. Its breeding range spans eastern North America and along the coast of California and northern to northeastern-central Mexico. It is a permanent resident throughout most of its range, though northern birds do migrate, mostly to central Mexico. The main conservation threat to the widespread species is deforestation.",https://upload.wikimedia.org/wikipedia/commons/thumb/6/62/Red-shouldered_Hawk_%28Buteo_lineatus%29_-_Blue_Cypress_Lake%2C_Florida.jpg/220px-Red-shouldered_Hawk_%28Buteo_lineatus%29_-_Blue_Cypress_Lake%2C_Florida.jpg,https://en.wikipedia.org/wiki/Red-shouldered_hawk
birds,Passeriformes,Sittidae: Nuthatches,rebnut,Red-breasted nuthatch,Sitta canadensis,0,0,0,LC,5,Words words words,Positive,-500,-0.5,March,"The red-breasted nuthatch (Sitta canadensis) is a small songbird. The adult has blue-grey upperparts with cinnamon underparts, a white throat and face with a black stripe through the eyes, a straight grey bill and a black crown. Its call, which has been likened to a tin trumpet, is high-pitched and nasal. It breeds in coniferous forests across Canada, Alaska and the northeastern and western United States. Though often a permanent resident, it regularly irrupts further south if its food supply fails. There are records of vagrants occurring as far south as the Gulf Coast and northern Mexico. It forages on the trunks and large branches of trees, often descending head first, sometimes catching insects in flight. It eats mainly insects and seeds, especially from conifers. It excavates its nest in dead wood, often close to the ground, smearing the entrance with pitch.",https://upload.wikimedia.org/wikipedia/commons/thumb/d/d2/Sitta_canadensis_CT2.jpg/220px-Sitta_canadensis_CT2.jpg,https://en.wikipedia.org/wiki/Red-breasted_nuthatch
birds,Passeriformes,"Corvidae: Jays, Crows & Magpies",amecro,American crow,Corvus brachyrhynchos,0,0,0,LC,5,Words words words,Positive,-500,-0.5,March,"The American crow (Corvus brachyrhynchos) is a large passerine bird species of the family Corvidae. It is a common bird found throughout much of North America. American crows are the New World counterpart to the carrion crow and the hooded crow. Although the American crow and the hooded crow are very similar in size, structure and behavior, their calls and visual appearance are different. The American crow, nevertheless, occupies the same ecological niche that the hooded crow and carrion crow do in Eurasia.",https://upload.wikimedia.org/wikipedia/commons/thumb/0/0a/Corvus-brachyrhynchos-001.jpg/220px-Corvus-brachyrhynchos-001.jpg,https://en.wikipedia.org/wiki/American_crow
birds,Passeriformes,Parulidae: Wood Warblers,pinwar,Pine warbler,Setophaga pinus,0,0,0,LC,5,Words words words,Positive,-500,-0.5,March,The pine warbler (Setophaga pinus) is a small songbird of the New World warbler family.,https://upload.wikimedia.org/wikipedia/commons/thumb/8/8e/Dendroica_pinus.jpg/220px-Dendroica_pinus.jpg,https://en.wikipedia.org/wiki/Pine_warbler
birds,Passeriformes,Passerellidae: New World Sparrows and Towhees,whcspa,White-crowned sparrow,Zonotrichia leucophrys,0,0,0,LC,5,Words words words,Positive,-500,-0.5,March,"The white-crowned sparrow (Zonotrichia leucophrys) is a species of passerine bird native to North America. A medium-sized member of the New World sparrow family, this species is marked by a grey face and black and white streaking on the upper head. It breeds in brushy areas in the taiga and tundra of the northernmost parts of the continent and in the Rocky Mountains and Pacific coast. While southerly populations in the Rocky Mountains and coast are largely resident, the breeding populations of the northerly part of its range are migratory and can be found as wintering or passage visitors through most of North America south to central Mexico.",https://upload.wikimedia.org/wikipedia/commons/thumb/9/92/White-crowned-Sparrow.jpg/220px-White-crowned-Sparrow.jpg,https://en.wikipedia.org/wiki/White-crowned_sparrow
birds,Passeriformes,Tyrannidae: Tyrant Flycatchers,easpho,Eastern phoebe,Sayornis phoebe,0,0,0,LC,5,Words words words,Positive,-500,-0.5,March,"The eastern phoebe (Sayornis phoebe) is a small passerine bird. The genus name Sayornis is constructed from the specific part of Charles Lucien Bonaparte's name for Say's phoebe, Muscicapa saya, and Ancient Greek ornis, ""bird"".[2]Phoebe is an alternative name for the Roman moon-goddess Diana, but it may also have been chosen to imitate the bird's call.[3]",https://upload.wikimedia.org/wikipedia/commons/thumb/d/d0/Sayornis_phoebe_-Owen_Conservation_Park%2C_Madison%2C_Wisconsin%2C_USA-8.jpg/220px-Sayornis_phoebe_-Owen_Conservation_Park%2C_Madison%2C_Wisconsin%2C_USA-8.jpg,https://en.wikipedia.org/wiki/Eastern_phoebe
birds,Accipitriformes,"Accipitridae: Kites, Hawks & Eagles",coohaw,Cooper's hawk,Accipiter cooperii,0,0,0,LC,5,Words words words,Positive,-500,-0.5,March,"Cooper's hawk (Accipiter cooperii) is a medium-sized hawk native to the North American continent and found from southern Canada to Mexico.[2] This species is a member of the genus Accipiter, sometimes referred to as true hawks, which are famously agile, relatively small hawks common to wooded habitats around the world and also the most diverse of all diurnal raptor genera.[2] As in many birds of prey, the male is smaller than the female.[3] The birds found east of the Mississippi River tend to be larger on average than the birds found to the west.[4] It is easily confused with the smaller but similar Sharp-shinned hawk.",https://upload.wikimedia.org/wikipedia/commons/thumb/5/5a/Accipiter_cooperii_m_Sam_Smith_Toronto3.jpg/220px-Accipiter_cooperii_m_Sam_Smith_Toronto3.jpg,https://en.wikipedia.org/wiki/Cooper%27s_hawk
birds,Piciformes,Picidae: Woodpeckers,norfli,Northern flicker,Colaptes auratus,0,0,0,LC,5,Words words words,Positive,-500,-0.5,March,"The northern flicker (Colaptes auratus) or common flicker is a medium-sized bird of the woodpecker family. It is native to most of North America, parts of Central America, Cuba, and the Cayman Islands, and is one of the few woodpecker species that migrate. Over 100 common names for the northern flicker are known, including yellowhammer (not to be confused with the Eurasian yellowhammer), clape, gaffer woodpecker, harry-wicket[citation needed], heigh-ho, wake-up, walk-up, wick-up, yarrup, and gawker bird. Many of these names derive from attempts to imitate some of its calls.  It is the state bird of Alabama (known by its colloquial name ""Yellowhammer."")[2]",https://upload.wikimedia.org/wikipedia/commons/thumb/0/02/NorthernFlicker-male.jpg/220px-NorthernFlicker-male.jpg,https://en.wikipedia.org/wiki/Northern_flicker
birds,Passeriformes,"Mimidae: Catbirds, Mockingbirds & Thrashers",brnthr,Brown thrasher,Toxostoma rufum,0,0,0,LC,5,Words words words,Positive,-500,-0.5,March,"The brown thrasher (Toxostoma rufum), sometimes erroneously called the brown thrush or fox-coloured thrush, is a bird in the family Mimidae, which also includes the New World catbirds and mockingbirds. The brown thrasher is abundant throughout the eastern and central United States and southern and central Canada, and it is the only thrasher to live primarily east of the Rockies and central Texas. It is the state bird of Georgia.",https://upload.wikimedia.org/wikipedia/commons/thumb/f/fb/Brown_thrasher_in_CP_%2802147%29.jpg/220px-Brown_thrasher_in_CP_%2802147%29.jpg,https://en.wikipedia.org/wiki/Brown_thrasher
birds,Passeriformes,Bombycillidae: Waxwings,cedwax,Cedar waxwing,Bombycilla cedrorum,0,0,0,LC,5,Words words words,Positive,-500,-0.5,March,"The cedar waxwing (Bombycilla cedrorum) is a member of the family Bombycillidae or waxwing family of passerine birds. It is a medium-sized, mostly brown, gray, and yellow. This bird is named for its wax-like wing tips. It is a native of North and Central America, breeding in open wooded areas in southern Canada and wintering in the southern half of the United States, Central America, and the far northwest of South America. Its diet includes cedar cones, fruit, holly berries, and insects.[2] The cedar waxwing is listed as least concern on the IUCN Red List.",https://upload.wikimedia.org/wikipedia/commons/thumb/7/73/Cedar_Waxwing_-_Bombycilla_cedrorum%2C_George_Washington%27s_Birthplace_National_Monument%2C_Colonial_Beach%2C_Virginia_%2839997434862%29.jpg/220px-Cedar_Waxwing_-_Bombycilla_cedrorum%2C_George_Washington%27s_Birthplace_National_Monument%2C_Colonial_Beach%2C_Virginia_%2839997434862%29.jpg,https://en.wikipedia.org/wiki/Cedar_waxwing
birds,Passeriformes,"Corvidae: Jays, Crows & Magpies",fiscro,Fish crow,Corvus ossifragus,0,0,0,LC,5,Words words words,Positive,-500,-0.5,March,The fish crow (Corvus ossifragus) is a species of crow associated with wetland habitats in the eastern and southeastern United States.,https://upload.wikimedia.org/wikipedia/commons/thumb/0/08/Fish_crow_in_Red_Hook_%2842712%29.jpg/220px-Fish_crow_in_Red_Hook_%2842712%29.jpg,https://en.wikipedia.org/wiki/Fish_crow
birds,Passeriformes,Certhiidae: Creepers,brncre,Brown creeper,Certhia americana,0,0,0,LC,5,Words words words,Positive,-500,-0.5,March,"The brown creeper (Certhia americana), also known as the American treecreeper, is a small songbird, the only North American member of the treecreeper family Certhiidae.",https://upload.wikimedia.org/wikipedia/commons/thumb/f/fc/Certhia-americana-001.jpg/220px-Certhia-americana-001.jpg,https://en.wikipedia.org/wiki/Brown_creeper
birds,Passeriformes,Parulidae: Wood Warblers,prawar,Prairie warbler,Setophaga discolor,0,0,0,LC,5,Words words words,Positive,-500,-0.5,March,The prairie warbler (Setophaga discolor) is a small songbird of the New World warbler family.,https://upload.wikimedia.org/wikipedia/commons/thumb/e/e5/Prairie_warbler_%28Setophaga_discolor_paludicola%29_male_J.jpg/220px-Prairie_warbler_%28Setophaga_discolor_paludicola%29_male_J.jpg,https://en.wikipedia.org/wiki/Prairie_warbler
birds,Passeriformes,"Cardinalidae: Tanagers, Cardinals, Grosbeaks & Dickcissels",robgro,Rose-breasted grosbeak,Pheucticus ludovicianus,0,0,0,LC,5,Words words words,Positive,-500,-0.5,March,"The rose-breasted grosbeak (Pheucticus ludovicianus), colloquially called ""cut-throat"" due to its coloration,[2][3] is a large, seed-eating grosbeak in the cardinal family (Cardinalidae). It is primarily a foliage gleaner.[4] Males have black heads, wings, backs, and tails, and a bright rose colored patch on their white breast. Males and females exhibit marked sexual dimorphism.",https://upload.wikimedia.org/wikipedia/commons/thumb/5/56/Pheucticus_ludovicianus_CT2.jpg/220px-Pheucticus_ludovicianus_CT2.jpg,https://en.wikipedia.org/wiki/Rose-breasted_grosbeak
birds,Passeriformes,Passerellidae: New World Sparrows and Towhees,foxspa,Fox sparrow,Passerella iliaca,0,0,0,LC,5,Words words words,Positive,-500,-0.5,March,"The fox sparrow (Passerella iliaca) is a large New World sparrow. It is the only member of the genus Passerella, although some authors split the species into four (see below).",https://upload.wikimedia.org/wikipedia/commons/thumb/1/13/Passerella_iliaca-001.jpg/220px-Passerella_iliaca-001.jpg,https://en.wikipedia.org/wiki/Fox_sparrow
birds,Columbiformes,Columbidae: Pigeons and Doves,rocpig1,Rock dove,Columba livia,0,0,0,LC,5,Words words words,Positive,-500,-0.5,March,"The rock dove, rock pigeon, or common pigeon (/ˈpɪdʒ.ən/ also /ˈpɪdʒ.ɪn/; Columba livia) is a member of the bird family Columbidae (doves and pigeons).[3]: 624  In common usage, it is often simply referred to as the ""pigeon"".",https://upload.wikimedia.org/wikipedia/commons/thumb/5/56/Paloma_brav%C3%ADa_%28Columba_livia%29%2C_Palacio_de_Nymphenburg%2C_M%C3%BAnich%2C_Alemania01.JPG/220px-Paloma_brav%C3%ADa_%28Columba_livia%29%2C_Palacio_de_Nymphenburg%2C_M%C3%BAnich%2C_Alemania01.JPG,https://en.wikipedia.org/wiki/Rock_dove
birds,Passeriformes,Passerellidae: New World Sparrows and Towhees,swaspa,Swamp sparrow,Melospiza georgiana,0,0,0,LC,5,Words words words,Positive,-500,-0.5,March,The swamp sparrow (Melospiza georgiana) is a medium-sized New World sparrow related to the song sparrow.,https://upload.wikimedia.org/wikipedia/commons/thumb/b/bc/Melospiza_georgiana_MN1.jpg/220px-Melospiza_georgiana_MN1.jpg,https://en.wikipedia.org/wiki/Swamp_sparrow
birds,Passeriformes,Regulidae: Kinglets,gockin,Golden-crowned kinglet,Regulus satrapa,0,0,0,LC,5,Words words words,Positive,-500,-0.5,March,The golden-crowned kinglet (Regulus satrapa) is a very small songbird in the family Regulidae that lives throughout much of North America.,https://upload.wikimedia.org/wikipedia/commons/thumb/8/84/Regulus_satrapa_-Canada-8a.jpg/220px-Regulus_satrapa_-Canada-8a.jpg,https://en.wikipedia.org/wiki/Golden-crowned_kinglet
birds,Passeriformes,Parulidae: Wood Warblers,myrwar,Yellow-rumped warbler,Setophaga coronata,0,0,0,LC,5,Words words words,Positive,-500,-0.5,March,"The yellow-rumped warbler (Setophaga coronata) is a regular North American bird species that can be commonly observed all across the continent. Its extensive distribution range connects both the Pacific and Atlantic coasts of the U.S. as well as Canada and Central America, with the population concentrating in the continent's northern parts during the breeding season and migrating southwards to southern North and Central America in Winter. The species generally prefers coniferous forests or mixed coniferous-deciduous forests as its breeding habitat, while during the winter it can be found inhabiting more open areas such as shrublands that offer food resources. The diet of the yellow-rumped warbler is based primarily on insects, though the species does eat fruits such as juniper berries as well, especially in winter.",https://upload.wikimedia.org/wikipedia/commons/thumb/6/62/Audubon%27s_Warbler_Setophaga_auduboni.jpg/220px-Audubon%27s_Warbler_Setophaga_auduboni.jpg,https://en.wikipedia.org/wiki/Yellow-rumped_warbler
birds,Passeriformes,"Icteridae: Blackbirds, Meadowlarks & Orioles",yehbla,Yellow-headed blackbird,Xanthocephalus xanthocephalus,0,0,0,LC,5,Words words words,Positive,-500,-0.5,March,The yellow-headed blackbird (Xanthocephalus xanthocephalus) is a medium-sized blackbird with a yellow head.,https://upload.wikimedia.org/wikipedia/commons/thumb/3/3b/Male_Yellow-headed_Blackbird.jpg/260px-Male_Yellow-headed_Blackbird.jpg,https://en.wikipedia.org/wiki/Yellow-headed_blackbird
birds,Passeriformes,"Icteridae: Blackbirds, Meadowlarks & Orioles",y00227,Rusty blackbird,Euphagus carolinus,0,0,0,VU,5,Words words words,Positive,-500,-0.5,March,"The rusty blackbird (Euphagus carolinus) is a medium-sized New World blackbird, closely related to grackles (""rusty grackle"" is an older name for the species). It is a bird that prefers wet forested areas, breeding in the boreal forest and muskeg across northern Canada, and migrating southeast to the United States during winter.",https://upload.wikimedia.org/wikipedia/commons/thumb/b/b7/Euphagus-carolinus-001.jpg/220px-Euphagus-carolinus-001.jpg,https://en.wikipedia.org/wiki/Rusty_blackbird
