species_grp,order,family,species_code,common_name,scientific_name,count_2021,count_2020,count_5yr,cons_status,cons_score,cons_desc,diff,abs_diff,perc_diff,peak_month,description,image_url,website
birds,Passeriformes,Turdidae: Thrushes,easblu,Eastern bluebird,Sialia sialis,0,0,0,LC,5,Words words words,Positive,-500,-0.5,March,"The eastern bluebird (Sialia sialis) is a small North American migratory thrush found in open woodlands, farmlands, and orchards.",https://upload.wikimedia.org/wikipedia/commons/thumb/0/00/Sialia_sialis_-Michigan%2C_USA_-pair-8c.jpg/220px-Sialia_sialis_-Michigan%2C_USA_-pair-8c.jpg,https://en.wikipedia.org/wiki/Eastern_bluebird
birds,Piciformes,Picidae: Woodpeckers,rebwoo,Red-bellied woodpecker,Melanerpes carolinus,0,0,0,LC,5,Words words words,Positive,-500,-0.5,March,"The red-bellied woodpecker (Melanerpes carolinus) is a medium-sized woodpecker of the family Picidae. It breeds mainly in the eastern United States, ranging as far south as Florida and as far north as Canada. Though it has a vivid orange-red crown and nape it is not to be confused with the red-headed woodpecker, a separate species of woodpecker in the same genus with an entirely red head and neck that sports a solid black back and white belly.  The red-bellied earns its name from the pale reddish blush of its lower underside.",https://upload.wikimedia.org/wikipedia/commons/thumb/1/12/Red-bellied_Woodpecker-27527.jpg/220px-Red-bellied_Woodpecker-27527.jpg,https://en.wikipedia.org/wiki/Red-bellied_woodpecker
birds,Passeriformes,Paridae: Chickadees and Titmice,carchi,Carolina chickadee,Poecile carolinensis,0,0,0,LC,5,Words words words,Positive,-500,-0.5,March,The Carolina chickadee (Poecile carolinensis) is a small passerine bird in the tit family Paridae.,https://upload.wikimedia.org/wikipedia/commons/thumb/5/56/Carolina_Chickadee1_by_Dan_Pancamo.jpg/220px-Carolina_Chickadee1_by_Dan_Pancamo.jpg,https://en.wikipedia.org/wiki/Carolina_chickadee
birds,Passeriformes,"Cardinalidae: Tanagers, Cardinals, Grosbeaks & Dickcissels",norcar,Northern cardinal,Cardinalis cardinalis,0,0,0,LC,5,Words words words,Positive,-500,-0.5,March,"The northern cardinal (Cardinalis cardinalis) is a bird in the genus Cardinalis; it is also known colloquially as the redbird, common cardinal, red cardinal, or just cardinal (which was its name prior to 1985). It can be found in southeastern Canada, through the eastern United States from Maine to Minnesota to Texas, New Mexico, southern Arizona, southern California, and south through Mexico, Belize, and Guatemala. It is also an introduced species in a few locations such as Bermuda and Hawaii. Its habitat includes woodlands, gardens, shrublands, and wetlands.",https://upload.wikimedia.org/wikipedia/commons/thumb/5/5c/Male_northern_cardinal_in_Central_Park_%2852612%29.jpg/220px-Male_northern_cardinal_in_Central_Park_%2852612%29.jpg,https://en.wikipedia.org/wiki/Northern_cardinal
birds,Passeriformes,Troglodytidae: Wrens,carwre,Carolina wren,Thryothorus ludovicianus,0,0,0,LC,5,Words words words,Positive,-500,-0.5,March,"The Carolina wren (Thryothorus ludovicianus) is a common species of wren that is a resident in the eastern half of the United States of America, the extreme south of Ontario, Canada, and the extreme northeast of Mexico. Severe winters restrict the northern limits of their range while favorable weather conditions lead to a northward extension of their breeding range. Their preferred habitat is in dense cover in forest, farm edges and suburban areas. This wren is the state bird of South Carolina.",https://upload.wikimedia.org/wikipedia/commons/thumb/6/65/Carolina_Wren1.jpg/220px-Carolina_Wren1.jpg,https://en.wikipedia.org/wiki/Carolina_wren
birds,Passeriformes,Sittidae: Nuthatches,whbnut,White-breasted nuthatch,Sitta carolinensis,0,0,0,LC,5,Words words words,Positive,-500,-0.5,March,"The white-breasted nuthatch breeds throughout much of North America, except in the cooler and drier areas. It is mainly found at low altitudes, in deciduous forests or in mixed woodlands. Seven to nine subspecies are generally distinguished by their slightly distinct distributions, vocalizations, and coloration. The species was once thought to be related to the white-cheeked nuthatch (S. leucopsis) and Przewalski's nuthatch (S. przewalskii), two species from southern Asia, but is actually more closely related to the giant nuthatch (S. magna), also from Southeast Asia. The species enjoys a very wide distribution and its population is said to be increasing; the International Union for the Conservation of Nature therefore considers it to be of ""least concern.""",https://upload.wikimedia.org/wikipedia/commons/thumb/0/09/Sitta-carolinensis-001.jpg/220px-Sitta-carolinensis-001.jpg,https://en.wikipedia.org/wiki/White-breasted_nuthatch
birds,Passeriformes,Paridae: Chickadees and Titmice,tuftit,Tufted titmouse,Baeolophus bicolor,0,0,0,LC,5,Words words words,Positive,-500,-0.5,March,"The tufted titmouse (Baeolophus bicolor) is a small songbird from North America, a species in the tit and chickadee family (Paridae). The black-crested titmouse, found from central and southern Texas southward,[2] was included as a subspecies, but now is considered a separate species, Baeolophus atricristatus.[3]",https://upload.wikimedia.org/wikipedia/commons/thumb/d/db/TuftedTitmouse_Gam.jpg/220px-TuftedTitmouse_Gam.jpg,https://en.wikipedia.org/wiki/Tufted_titmouse
birds,Passeriformes,"Mimidae: Catbirds, Mockingbirds & Thrashers",normoc,Northern mockingbird,Mimus polyglottos,0,0,0,LC,5,Words words words,Positive,-500,-0.5,March,"The northern mockingbird is an omnivore, eating both insects and fruits. It is often found in open areas and forest edges but forages in grassy land. The northern mockingbird breeds in southeastern Canada, the United States, northern Mexico, the Bahamas, the Cayman Islands and the Greater Antilles. It is replaced further south by its closest living relative, the tropical mockingbird. The Socorro mockingbird, an endangered species, is also closely related, contrary to previous opinion. The northern mockingbird is listed as of least concern according to the International Union for Conservation of Nature (IUCN).",https://upload.wikimedia.org/wikipedia/commons/thumb/6/6b/Mockingbird_in_Bay_Ridge_%2885082%29.jpg/220px-Mockingbird_in_Bay_Ridge_%2885082%29.jpg,https://en.wikipedia.org/wiki/Northern_mockingbird
birds,Passeriformes,Passerellidae: New World Sparrows and Towhees,daejun,Dark-eyed junco,Junco hyemalis,0,0,0,LC,5,Words words words,Positive,-500,-0.5,March,"The dark-eyed junco (Junco hyemalis) is a species of junco, a group of small, grayish New World sparrows. This bird is common across much of temperate North America and in summer ranges far into the Arctic. It is a very variable species, much like the related fox sparrow (Passerella iliaca), and its systematics are still not completely untangled.",https://upload.wikimedia.org/wikipedia/commons/thumb/3/36/Dark-eyed_Junco%2C_Washington_State_02.jpg/220px-Dark-eyed_Junco%2C_Washington_State_02.jpg,https://en.wikipedia.org/wiki/Dark-eyed_junco
birds,Piciformes,Picidae (Woodpeckers),dowwoo,Downy woodpecker,Picoides pubescens,0,0,0,LC,5,Words words words,Positive,-500,-0.5,March,"The downy woodpecker was described and illustrated with a hand-coloured plate by the English naturalist Mark Catesby in his The Natural History of Carolina, Florida and the Bahama Islands, which was published between 1729 and 1732.[2] When in 1766 the Swedish naturalist Carl Linnaeus updated his Systema Naturae for the twelfth edition, he included the downy woodpecker, coined the binomial name Picus pubescens and cited Catesby's book.[3] The specific epithet pubescens is the Latin for ""pubescent"" or ""downy"".[4] Linnaeus specified the type locality as America septentrionali (North America) but the locality is now restricted to South Carolina.[5] The downy woodpecker was usually placed in either Dendrocopos or Picoides, but a molecular phylogenetic study published in 2015 found that these genera did not form monophyletic groups.[6] In the revised generic classification, the downy woodpecker was placed with four other species in the resurrected genus Dryobates, that had been erected in 1826 by the German naturalist Friedrich Boie with the downy woodpecker as the type species.[7][8] Within the genus, the downy woodpecker is sister to a clade containing Nuttall's woodpecker (Dryobates nuttalli) and the ladder-backed woodpecker (Dryobates scalaris).[9]",https://upload.wikimedia.org/wikipedia/commons/thumb/c/c1/FemaleDownyWoodpecker.jpg/220px-FemaleDownyWoodpecker.jpg,https://en.wikipedia.org/wiki/Downy_woodpecker
birds,Passeriformes,"Fringillidae: Siskins, Crossbills & Allies",pinsis,Pine siskin,Spinus pinus,0,0,0,LC,5,Words words words,Positive,-500,-0.5,March,The pine siskin (Spinus pinus) is a North American bird in the finch family. It is a migratory bird with an extremely sporadic winter range.,https://upload.wikimedia.org/wikipedia/commons/thumb/2/2e/Carduelis_pinus_CT7.jpg/220px-Carduelis_pinus_CT7.jpg,https://en.wikipedia.org/wiki/Pine_siskin
birds,Columbiformes,Columbidae: Pigeons and Doves,moudov,Mourning dove,Zenaida macroura,0,0,0,LC,5,Words words words,Positive,-500,-0.5,March,"The mourning dove (Zenaida macroura) is a member of the dove family, Columbidae. The bird is also known as the American mourning dove, the rain dove, and colloquially as the turtle dove, and was once known as the Carolina pigeon and Carolina turtledove.[2] It is one of the most abundant and widespread of all North American birds and a popular gamebird, with more than 20 million birds (up to 70 million in some years) shot annually in the U.S., both for sport and meat. Its ability to sustain its population under such pressure is due to its prolific breeding; in warm areas, one pair may raise up to six broods of two young each in a single year. The wings make an unusual whistling sound upon take-off and landing, a form of sonation. The bird is a strong flier, capable of speeds up to 88 km/h (55 mph).[3]",https://upload.wikimedia.org/wikipedia/commons/thumb/b/b7/Mourning_Dove_2006.jpg/220px-Mourning_Dove_2006.jpg,https://en.wikipedia.org/wiki/Mourning_dove
birds,Passeriformes,Sittidae: Nuthatches,bnhnut,Brown-headed nuthatch,Sitta pusilla,0,0,0,LC,5,Words words words,Positive,-500,-0.5,March,"The brown-headed nuthatch (Sitta pusilla) is a small songbird found endemic to pine forests throughout the Southeastern United States. Genetic analyses indicated low differentiation between northern and southern populations in Florida, but the study also found  lower genetic diversity among south Florida populations that may be a result of the increased habitat fragmentation that was documented. The Bahama nuthatch was formerly considered a subspecies (S. p. insularis), has since been reclassified as its own separate species.[2][3] Two recent studies assessing vocalizations in Bahama and continental nuthatch populations found important differences.[4][5]  One of the studies[4] also demonstrated that  continental and Bahama populations did not respond aggressively to calls of the other population. This type of call-response study is often used to help define cryptic species.[6]",https://upload.wikimedia.org/wikipedia/commons/thumb/0/0a/Brown-headed_Nuthatch-27527-4c.jpg/220px-Brown-headed_Nuthatch-27527-4c.jpg,https://en.wikipedia.org/wiki/Brown-headed_nuthatch
birds,Accipitriformes,"Accipitridae: Kites, Hawks & Eagles",rethaw,Red-tailed hawk,Buteo jamaicensis,0,0,0,LC,5,Words words words,Positive,-500,-0.5,March,"The red-tailed hawk (Buteo jamaicensis) is a bird of prey that breeds throughout most of North America, from the interior of Alaska and northern Canada to as far south as Panama and the West Indies. It is one of the most common members within the genus of Buteo in North America or worldwide.[2] The red-tailed hawk is one of three species colloquially known in the United States as the ""chickenhawk"", though it rarely preys on standard-sized chickens.[3] The bird is sometimes also referred to as the red-tail for short, when the meaning is clear in context. Red-tailed hawks can acclimate to all the biomes within their range, occurring on the edges of non-ideal habitats such as dense forests and sandy deserts.[4] The red-tailed hawk occupies a wide range of habitats and altitudes, including deserts, grasslands (from small meadows to the treed fringes of more extensive prairies), coniferous and deciduous forests, agricultural fields, and urban areas. Its latitudinal limits fall around the tree line in the subarctic and it is absent from the high Arctic. Generally it favors varied habitats with open woodland, woodland edge and open terrain. It is legally protected in Canada, Mexico, and the United States by the Migratory Bird Treaty Act.",https://upload.wikimedia.org/wikipedia/commons/thumb/3/32/Red-tailed_Hawk.jpg/220px-Red-tailed_Hawk.jpg,https://en.wikipedia.org/wiki/Red-tailed_hawk
birds,Piciformes,Picidae (Woodpeckers),haiwoo,Hairy woodpecker,Picoides villosus,0,0,0,LC,5,Words words words,Positive,-500,-0.5,March,"The hairy woodpecker was described and illustrated with a hand-coloured plate by the English naturalist Mark Catesby in his The Natural History of Carolina, Florida and the Bahama Islands which was published between 1729 and 1732.[5] When in 1766 the Swedish naturalist Carl Linnaeus updated his Systema Naturae for the twelfth edition, he included the downy woodpecker, coined the binomial name Picus villosus and cited Catesby's book.[6] The specific epithet villosus is the Latin word for ""hairy"".[7] Linnaeus specified the type locality as America septentrionali (North America), with specific mention of Raccoon, New Jersey.[8] The hairy woodpecker was formerly usually placed in either Dendrocopos or Picoides but a molecular phylogenetic study published in 2015 found that these genera did not form monophyletic groups.[9] In the revised generic classification, the hairy woodpecker was moved to the genus Leuconotopicus that was erected by the French ornithologist Alfred Malherbe in 1845.[10][11] Some taxonomic authorities place the hairy woodpecker in an expanded Dryobates that includes all the species in the genera Leuconotopicus and Veniliornis.[12][13]",https://upload.wikimedia.org/wikipedia/commons/thumb/3/3a/Picoides_villosus_monticola_male1.jpg/220px-Picoides_villosus_monticola_male1.jpg,https://en.wikipedia.org/wiki/Hairy_woodpecker
birds,Passeriformes,Passerellidae: New World Sparrows and Towhees,sonspa,Song sparrow,Melospiza melodia,0,0,0,LC,5,Words words words,Positive,-500,-0.5,March,"The song sparrow (Melospiza melodia) is a medium-sized New World sparrow. Among the native sparrows in North America, it is easily one of the most abundant, variable and adaptable species.",https://upload.wikimedia.org/wikipedia/commons/thumb/0/00/Song_sparrow_in_Prospect_Park_%2893031%29.jpg/220px-Song_sparrow_in_Prospect_Park_%2893031%29.jpg,https://en.wikipedia.org/wiki/Song_sparrow
birds,Piciformes,Picidae: Woodpeckers,pilwoo,Pileated woodpecker,Dryocopus pileatus,0,0,0,LC,5,Words words words,Positive,-500,-0.5,March,"The pileated woodpecker (Dryocopus pileatus) is a large, mostly black woodpecker native to North America. An insectivore, it inhabits deciduous forests in eastern North America, the Great Lakes, the boreal forests of Canada, and parts of the Pacific Coast. It is the largest extant woodpecker species in North America, with the possible exception of the ivory-billed woodpecker, which the U.S. Fish and Wildlife Service has proposed be reclassified as extinct. It is also the third largest species of woodpecker in the world, after the great slaty woodpecker and the black woodpecker. ""Pileated"" refers to the bird's prominent red crest, from the Latin pileatus meaning ""capped"".[2]",https://upload.wikimedia.org/wikipedia/commons/thumb/4/4c/Pileated_Woodpecker_%289597212081%29%2C_crop.jpg/220px-Pileated_Woodpecker_%289597212081%29%2C_crop.jpg,https://en.wikipedia.org/wiki/Pileated_woodpecker
birds,Passeriformes,"Fringillidae: Siskins, Crossbills & Allies",purfin,Purple finch,Haemorhous purpureus,0,0,0,LC,5,Words words words,Positive,-500,-0.5,March,"The purple finch (Haemorhous purpureus) is a bird in the finch family, Fringillidae.",https://upload.wikimedia.org/wikipedia/commons/thumb/d/dd/Carpodacus_purpureus_CT4.jpg/220px-Carpodacus_purpureus_CT4.jpg,https://en.wikipedia.org/wiki/Purple_finch
birds,Passeriformes,Turdidae: Thrushes,herthr,Hermit thrush,Catharus guttatus,0,0,0,LC,5,Words words words,Positive,-500,-0.5,March,"The hermit thrush (Catharus guttatus) is a medium-sized North American thrush. It is not very closely related to the other North American migrant species of Catharus, but rather to the Mexican russet nightingale-thrush.[2] The specific name guttatus is Latin for ""spotted"".[3]",https://upload.wikimedia.org/wikipedia/commons/thumb/d/d3/Hermit_thrush_qmnonic.jpg/220px-Hermit_thrush_qmnonic.jpg,https://en.wikipedia.org/wiki/Hermit_thrush
birds,Passeriformes,Passerellidae: New World Sparrows and Towhees,chispa,Chipping sparrow,Spizella passerina,0,0,0,LC,5,Words words words,Positive,-500,-0.5,March,"The chipping sparrow (Spizella passerina) is a species of New World sparrow, a passerine bird in the family Passerellidae. It is widespread, fairly tame, and common across most of its North American range.",https://upload.wikimedia.org/wikipedia/commons/thumb/2/29/Spizella-passerina-015_edit.jpg/220px-Spizella-passerina-015_edit.jpg,https://en.wikipedia.org/wiki/Chipping_sparrow
birds,Passeriformes,"Icteridae: Blackbirds, Meadowlarks & Orioles",bnhcow,Brown-headed cowbird,Molothrus ater,0,0,0,LC,5,Words words words,Positive,-500,-0.5,March,"The brown-headed cowbird was described by the French polymath Georges-Louis Leclerc, Comte de Buffon in 1775 in his Histoire Naturelle des Oiseaux from a specimen collected in the Carolinas.[3] The bird was also illustrated in a hand-colored plate engraved by François-Nicolas Martinet in the Planches Enluminées D'Histoire Naturelle, which was produced under the supervision of Edme-Louis Daubenton to accompany Buffon's text.[4] Neither the plate caption nor Buffon's description included a scientific name, but in 1783, Dutch naturalist Pieter Boddaert coined the binomial name Oriolus ater in his catalogue of the Planches Enluminées.[5] The brown-headed cowbird is now placed in the genus Molothrus that was introduced by  English naturalist William John Swainson in 1832 with the brown-headed cowbird as the type species.[6][7] The genus name combines the Ancient Greek mōlos meaning ""struggle"" or ""battle"" with thrōskō meaning ""to sire"" or ""to impregnate"". The specific name ater is Latin for ""dull black"".[8] The English name ""cowbird"", first recorded in 1839, refers to this species often being seen near cattle.[9]",https://upload.wikimedia.org/wikipedia/commons/thumb/e/e6/Brown_headed_cowbird_female_in_JBWR_%2825487%29.jpg/220px-Brown_headed_cowbird_female_in_JBWR_%2825487%29.jpg,https://en.wikipedia.org/wiki/Brown-headed_cowbird
birds,Passeriformes,Passerellidae: New World Sparrows and Towhees,eastow,Eastern towhee,Pipilo erythrophthalmus,0,0,0,LC,5,Words words words,Positive,-500,-0.5,March,"The eastern towhee (Pipilo erythrophthalmus) is a large New World sparrow. The taxonomy of the towhees has been under debate in recent decades, and formerly this bird and the spotted towhee were considered a single species, the rufous-sided towhee.",https://upload.wikimedia.org/wikipedia/commons/thumb/2/21/Pipilo_erythrophthalmus_-Quabbin_Reservoir%2C_Massachusetts%2C_USA_-male-8.jpg/220px-Pipilo_erythrophthalmus_-Quabbin_Reservoir%2C_Massachusetts%2C_USA_-male-8.jpg,https://en.wikipedia.org/wiki/Eastern_towhee
birds,Passeriformes,"Icteridae: Blackbirds, Meadowlarks & Orioles",comgra,Common grackle,Quiscalus quiscula,0,0,0,NT,5,Words words words,Positive,-500,-0.5,March,"The common grackle (Quiscalus quiscula) is a species of large icterid bird found in large numbers through much of North America. First described in 1758 by Carl Linnaeus, the common grackle has three subspecies. Adult common grackles have a long and dark bill, pale yellow eyes, and a long tail. Adults often have an iridescent appearance on their head, especially males. Common grackles can be found widely across North America east of the Rocky Mountains.",https://upload.wikimedia.org/wikipedia/commons/thumb/f/fd/Quiscalus-quiscula-001.jpg/220px-Quiscalus-quiscula-001.jpg,https://en.wikipedia.org/wiki/Common_grackle
birds,Passeriformes,"Icteridae: Blackbirds, Meadowlarks & Orioles",botgra,Boat-tailed grackle,Quiscalus major,0,0,0,LC,5,Words words words,Positive,-500,-0.5,March,"The boat-tailed grackle is found in coastal saltwater marshes and, in Florida, also on inland waters. Boat-tailed grackles have established significant populations in several United States Gulf Coast cities and towns, where they can be found foraging in trash bins, dumpsters, and parking lots.",https://upload.wikimedia.org/wikipedia/commons/thumb/c/c0/Quiscalus_major_-Three_Lakes_Wildlife_Management_Area%2C_Florida%2C_USA_-female-8.jpg/220px-Quiscalus_major_-Three_Lakes_Wildlife_Management_Area%2C_Florida%2C_USA_-female-8.jpg,https://en.wikipedia.org/wiki/Boat-tailed_grackle
birds,Passeriformes,"Cardinalidae: Tanagers, Cardinals, Grosbeaks & Dickcissels",blugrb1,Blue grosbeak,Passerina caerulea,0,0,0,LC,5,Words words words,Positive,-500,-0.5,March,"The blue grosbeak was formally described by the Swedish naturalist Carl Linnaeus in 1758 in the tenth edition of his Systema Naturae under the binomial name Loxia caerulea.[2] The specific epithet caerulea is the Latin word for ""blue"", ""azure-blue"", ""sky-blue"" or ""dark-blue"".[3] Linnaeus based his own description on the ""blew gross-beak"" described and illustrated by Mark Catesby in his The Natural History of Carolina, Florida and the Bahama Islands. The book had been published in 1729–1732.[4] Catesby gave the location as Carolina and Linnaeus specified America. The type location is now restricted to South Carolina.[5]",https://upload.wikimedia.org/wikipedia/commons/thumb/3/38/Blue_Grosbeak_female_RWD2.jpg/220px-Blue_Grosbeak_female_RWD2.jpg,https://en.wikipedia.org/wiki/Blue_grosbeak
birds,Passeriformes,Sturnidae: Starlings,eursta,Common starling,Sturnus vulgaris,0,0,0,LC,5,Words words words,Positive,-500,-0.5,March,"The common starling has about 12 subspecies breeding in open habitats across its native range in temperate Europe and across the Palearctic to western Mongolia, and it has been introduced to Australia, New Zealand, Canada, the United States, Mexico, Argentina, South Africa and Fiji.[2] This bird is resident in western and southern Europe and southwestern Asia, while northeastern populations migrate south and west in the winter within the breeding range and also further south to Iberia and North Africa. The common starling builds an untidy nest in a natural or artificial cavity in which four or five glossy, pale blue eggs are laid. These take two weeks to hatch and the young remain in the nest for another three weeks. There are normally one or two breeding attempts each year. This species is omnivorous, taking a wide range of invertebrates, as well as seeds and fruit. It is hunted by various mammals and birds of prey, and is host to a range of external and internal parasites.",https://upload.wikimedia.org/wikipedia/commons/thumb/7/7d/Toulouse_-_Sturnus_vulgaris_-_2012-02-26_-_3.jpg/220px-Toulouse_-_Sturnus_vulgaris_-_2012-02-26_-_3.jpg,https://en.wikipedia.org/wiki/Common_starling
birds,Passeriformes,Passeridae: Old World Sparrows,houspa,House sparrow,Passer domesticus,0,0,0,LC,5,Words words words,Positive,-500,-0.5,March,"The house sparrow (Passer domesticus) is a bird of the sparrow family Passeridae, found in most parts of the world. It is a small bird that has a typical length of 16 cm (6.3 in) and a mass of 24–39.5 g (0.85–1.39 oz). Females and young birds are coloured pale brown and grey, and males have brighter black, white, and brown markings. One of about 25 species in the genus Passer, the house sparrow is native to most of Europe, the Mediterranean Basin, and a large part of Asia. Its intentional or accidental introductions to many regions, including parts of Australasia, Africa, and the Americas, make it the most widely distributed wild bird.",https://upload.wikimedia.org/wikipedia/commons/thumb/5/52/House_Sparrow%2C_England_-_May_09.jpg/220px-House_Sparrow%2C_England_-_May_09.jpg,https://en.wikipedia.org/wiki/House_sparrow
birds,Passeriformes,Paridae: Chickadees and Titmice,y00033,Carolina chickadee,Poecile carolinensis,0,0,0,LC,5,Words words words,Positive,-500,-0.5,March,The Carolina chickadee (Poecile carolinensis) is a small passerine bird in the tit family Paridae.,https://upload.wikimedia.org/wikipedia/commons/thumb/5/56/Carolina_Chickadee1_by_Dan_Pancamo.jpg/220px-Carolina_Chickadee1_by_Dan_Pancamo.jpg,https://en.wikipedia.org/wiki/Carolina_chickadee
birds,Piciformes,Picidae: Woodpeckers,yebsap,Yellow-bellied sapsucker,Sphyrapicus varius,0,0,0,LC,5,Words words words,Positive,-500,-0.5,March,The yellow-bellied sapsucker (Sphyrapicus varius) is a medium-sized woodpecker that breeds in Canada and the northeastern United States.,https://upload.wikimedia.org/wikipedia/commons/thumb/1/1f/Yellow-bellied_sapsucker_%28Sphyrapicus_varius%29_female.JPG/220px-Yellow-bellied_sapsucker_%28Sphyrapicus_varius%29_female.JPG,https://en.wikipedia.org/wiki/Yellow-bellied_sapsucker
